{
  "id": "a1",
  "track": "explorers",
  "grade": "UKG",
  "title": "Meet the Computer",
  "summary": "Learn what a computer is and find computers around you.",
  "duration": "5-8 min",
  "objectives": ["Recognize a computer", "Distinguish computers from other objects"],
  "prerequisites": [],
  "vocabulary": ["computer", "screen", "keyboard"],
  "steps": [
    {
      "type": "story",
      "boltExpression": "wave",
      "boltSpeech": "Hi! I'm Bolt. Let's learn about computers!",
      "content": { 
        "text": "A computer is a machine that helps us learn and play!",
        "svgContent": "<svg viewBox=\"0 0 200 150\" width=\"100%\" height=\"200px\"><rect x=\"40\" y=\"30\" width=\"120\" height=\"80\" rx=\"8\" fill=\"#333\"/><rect x=\"45\" y=\"35\" width=\"110\" height=\"70\" fill=\"#e0f7fa\"/><rect x=\"70\" y=\"110\" width=\"60\" height=\"15\" fill=\"#aaa\"/><rect x=\"50\" y=\"130\" width=\"100\" height=\"10\" fill=\"#777\"/></svg>"
      }
    },
    {
      "type": "hotspot",
      "boltExpression": "pointing",
      "boltSpeech": "Tap each part to learn its name!",
      "diagramLabel": "A simple desktop computer",
      "svgContent": "<svg viewBox=\"0 0 300 200\" width=\"100%\" height=\"300px\"><rect x=\"50\" y=\"30\" width=\"140\" height=\"100\" rx=\"5\" fill=\"#333\"/><rect x=\"55\" y=\"35\" width=\"130\" height=\"90\" fill=\"#e0f7fa\"/><rect x=\"100\" y=\"130\" width=\"40\" height=\"20\" fill=\"#888\"/><rect x=\"70\" y=\"150\" width=\"100\" height=\"10\" rx=\"2\" fill=\"#555\"/><rect x=\"60\" y=\"170\" width=\"120\" height=\"20\" rx=\"2\" fill=\"#aaa\"/><rect x=\"210\" y=\"170\" width=\"25\" height=\"35\" rx=\"10\" fill=\"#999\"/></svg>",
      "hotspots": [
        { "id": "screen", "label": "Screen", "description": "Shows pictures and words, like a TV.", "icon": "🖥️", "x": 40, "y": 40 },
        { "id": "keyboard", "label": "Keyboard", "description": "Has buttons with letters and numbers.", "icon": "⌨️", "x": 40, "y": 85 },
        { "id": "mouse", "label": "Mouse", "description": "Helps you point and click on the screen.", "icon": "🖱️", "x": 75, "y": 90 }
      ]
    },
    {
      "type": "quiz",
      "boltExpression": "thinking",
      "boltSpeech": "Can you find the computer?",
      "questions": [
        {
          "type": "picture-choice",
          "prompt": "Which one is a computer?",
          "options": [
            { "label": "Laptop", "correct": true, "image": "<svg viewBox=\"0 0 100 100\"><path d=\"M20,60 L80,60 L75,20 L25,20 Z\" fill=\"#555\"/><rect x=\"15\" y=\"60\" width=\"70\" height=\"10\" rx=\"2\" fill=\"#aaa\"/></svg>" },
            { "label": "Chair", "correct": false, "image": "<svg viewBox=\"0 0 100 100\"><rect x=\"30\" y=\"20\" width=\"40\" height=\"40\" fill=\"#8d6e63\"/><rect x=\"30\" y=\"60\" width=\"40\" height=\"10\" fill=\"#795548\"/><rect x=\"35\" y=\"70\" width=\"5\" height=\"20\" fill=\"#5d4037\"/><rect x=\"60\" y=\"70\" width=\"5\" height=\"20\" fill=\"#5d4037\"/></svg>" }
          ],
          "feedback": { "correct": "Yes! A laptop is a computer you can carry.", "incorrect": "Not quite. A chair is for sitting." }
        },
        {
          "type": "picture-choice",
          "prompt": "Which one has a screen?",
          "options": [
            { "label": "Apple", "correct": false, "image": "<svg viewBox=\"0 0 100 100\"><circle cx=\"50\" cy=\"60\" r=\"30\" fill=\"#e53935\"/><path d=\"M50,30 Q60,10 70,20\" stroke=\"#4caf50\" stroke-width=\"4\" fill=\"none\"/></svg>" },
            { "label": "Tablet", "correct": true, "image": "<svg viewBox=\"0 0 100 100\"><rect x=\"25\" y=\"15\" width=\"50\" height=\"70\" rx=\"5\" fill=\"#333\"/><rect x=\"30\" y=\"20\" width=\"40\" height=\"60\" fill=\"#fff\"/></svg>" }
          ],
          "feedback": { "correct": "Right! A tablet is a small computer with a touch screen.", "incorrect": "Oops. An apple is a fruit!" }
        }
      ]
    }
  ]
}
