{
  "id": "a4",
  "track": "explorers",
  "grade": "UKG",
  "title": "Switch On, Switch Off",
  "summary": "Learn how to safely turn a computer on and off.",
  "duration": "5 min",
  "objectives": ["Identify the power button", "Understand that computers need to be turned on/off properly"],
  "prerequisites": ["a1"],
  "vocabulary": ["power", "switch", "button"],
  "steps": [
    {
      "type": "story",
      "boltExpression": "happy",
      "boltSpeech": "Before we can play, we have to wake the computer up!",
      "content": {
        "text": "Computers need electricity to work. We use the Power Button to turn them on.",
        "svgContent": "<svg viewBox=\"0 0 100 100\" width=\"150px\" height=\"150px\"><circle cx=\"50\" cy=\"50\" r=\"40\" fill=\"none\" stroke=\"#e74c3c\" stroke-width=\"8\"/><line x1=\"50\" y1=\"10\" x2=\"50\" y2=\"50\" stroke=\"#e74c3c\" stroke-width=\"8\" stroke-linecap=\"round\"/></svg>"
      }
    },
    {
      "type": "sort",
      "boltExpression": "thinking",
      "boltSpeech": "What needs electricity to turn on?",
      "instructions": "Sort the pictures into 'Needs Electricity' or 'No Electricity'.",
      "zones": [
        { "id": "yes", "title": "Needs Electricity", "icon": "⚡" },
        { "id": "no", "title": "No Electricity", "icon": "❌" }
      ],
      "items": [
        { "id": "computer", "label": "Computer", "zone": "yes", "icon": "💻" },
        { "id": "book", "label": "Book", "zone": "no", "icon": "📚" },
        { "id": "tv", "label": "TV", "zone": "yes", "icon": "📺" },
        { "id": "ball", "label": "Ball", "zone": "no", "icon": "⚽" }
      ]
    },
    {
      "type": "story",
      "boltExpression": "encouraging",
      "boltSpeech": "When we are done, we must ask a grown-up to turn it off properly.",
      "content": {
        "points": [
          { "icon": "🛑", "text": "Do not pull the plug!" },
          { "icon": "👨‍👩‍👧", "text": "Ask a grown-up for help to turn it off." }
        ]
      }
    }
  ]
}
