{
  "id": "a6",
  "track": "explorers",
  "grade": "UKG",
  "title": "Keyboard Fun",
  "summary": "Find letters and tap keys.",
  "duration": "5-8 min",
  "objectives": ["Locate letters on a keyboard", "Press keys"],
  "prerequisites": ["a3"],
  "vocabulary": ["keyboard", "keys", "type"],
  "steps": [
    {
      "type": "story",
      "boltExpression": "happy",
      "boltSpeech": "The keyboard lets us write words on the computer!",
      "content": {
        "text": "Every button on the keyboard is called a KEY. There are letters, numbers, and special keys.",
        "svgContent": "<svg viewBox=\"0 0 100 100\" width=\"150px\" height=\"150px\"><rect x=\"10\" y=\"30\" width=\"80\" height=\"40\" rx=\"5\" fill=\"#e0e0e0\" stroke=\"#999\" stroke-width=\"2\"/><rect x=\"15\" y=\"35\" width=\"10\" height=\"10\" rx=\"2\" fill=\"#fff\"/><rect x=\"30\" y=\"35\" width=\"10\" height=\"10\" rx=\"2\" fill=\"#fff\"/><rect x=\"45\" y=\"35\" width=\"10\" height=\"10\" rx=\"2\" fill=\"#fff\"/><rect x=\"60\" y=\"35\" width=\"10\" height=\"10\" rx=\"2\" fill=\"#fff\"/><rect x=\"75\" y=\"35\" width=\"10\" height=\"10\" rx=\"2\" fill=\"#fff\"/><rect x=\"15\" y=\"50\" width=\"10\" height=\"10\" rx=\"2\" fill=\"#fff\"/><rect x=\"30\" y=\"50\" width=\"10\" height=\"10\" rx=\"2\" fill=\"#fff\"/><rect x=\"45\" y=\"50\" width=\"10\" height=\"10\" rx=\"2\" fill=\"#fff\"/><rect x=\"60\" y=\"50\" width=\"10\" height=\"10\" rx=\"2\" fill=\"#fff\"/><rect x=\"75\" y=\"50\" width=\"10\" height=\"10\" rx=\"2\" fill=\"#fff\"/></svg>"
      }
    },
    {
      "type": "typing",
      "boltExpression": "encouraging",
      "boltSpeech": "Can you find these letters and tap them?",
      "instructions": "Find the letter A!",
      "sequence": ["A"]
    },
    {
      "type": "typing",
      "boltExpression": "happy",
      "boltSpeech": "Great! Let's find some more.",
      "instructions": "Find B, C, and D!",
      "sequence": ["B", "C", "D"]
    },
    {
      "type": "quiz",
      "boltExpression": "thinking",
      "boltSpeech": "What do we do with a keyboard?",
      "questions": [
        {
          "type": "picture-choice",
          "prompt": "What does a keyboard help us do?",
          "options": [
            { "label": "Listen to Music", "correct": false, "image": "<svg viewBox=\"0 0 100 100\"><circle cx=\"50\" cy=\"50\" r=\"30\" fill=\"none\" stroke=\"#333\" stroke-width=\"10\"/></svg>" },
            { "label": "Write Words", "correct": true, "image": "<svg viewBox=\"0 0 100 100\"><text x=\"50\" y=\"60\" font-size=\"40\" text-anchor=\"middle\" font-weight=\"bold\">ABC</text></svg>" }
          ]
        }
      ]
    }
  ]
}
